{
  "schema_version": 1, "command": "prepare", "mode": "execute", "status": "complete", "renewal_route": null,
  "native_profile": {"id": "local-tree-state-33d3a595", "raw_version": "jj 0.45.1-33d3a595429b7e3b54a8ea769560247913bc8a1b"},
  "selection": {"names": [], "groups": [], "resolved": [], "skipped": []},
  "source": {
    "name": "default", "root": {"display": "/donor", "unix_bytes_hex": "2f646f6e6f72"}, "operation_id": "accepted-operation",
    "recorded_commit_id": "old-donor", "source_commit_id": "actual-empty-child-S", "source_change_id": "new-source-change", "upstream_goal_commit_id": "fetched-goal",
    "state": "ready", "evidence": "produced",
    "assertion": {"revset": "trunk@origin", "commit_id": "fetched-goal", "status": "succeeded"},
    "upstream": {"remote": "origin", "bookmark": "trunk", "prospective_goal_commit_id": "old-remote-goal"},
    "preparation": {"status": "succeeded", "saved_commit_id": "saved-source", "steps": [{"index": "0", "argv": ["builder"], "status": "succeeded", "elapsed_ms": "0"}], "final_conformance": "succeeded", "elapsed_ms": "12"},
    "elapsed_ms": "12"
  },
  "desired": null, "preview": null, "receivers": [], "capture": null, "source_diagnostics": {"native": null, "ordinary": null},
  "timings": {"command_ms": "14", "engine_ms": null, "pre_native_ms": null, "ordinary_ms": null}, "error": null
}
